from,to,edge,core,mechanism,cites,cites_empirical,cite_weight,edge_betweenness,detail,type,title,color,value
change in constituency boundaries,issue salience,affects,NA,"Because we divide the electorate according to geography, local issues (issues of place) become more important than issues that are unrelated to place.",Gardner 2012,NA,1,1,"affects<br>Because we divide the electorate according to geography, local issues (issues of place) become more important than issues that are unrelated to place.<br>Gardner 2012",affects,"<p>affects<br>Because we divide the electorate according to geography, local issues (issues of place) become more important than issues that are unrelated to place.<br>Gardner 2012</p>",#617d9f,1
change in constituency boundaries,degree of political conflict,affects,NA,"Districts can be drawn such that the electorate within each district is homogeneous or heterogeneous (along some relevant political dimension). The more heterogeneous the district, the greater likelihood of political conflict.",Gardner 2012,NA,1,1,"affects<br>Districts can be drawn such that the electorate within each district is homogeneous or heterogeneous (along some relevant political dimension). The more heterogeneous the district, the greater likelihood of political conflict.<br>Gardner 2012",affects,"<p>affects<br>Districts can be drawn such that the electorate within each district is homogeneous or heterogeneous (along some relevant political dimension). The more heterogeneous the district, the greater likelihood of political conflict.<br>Gardner 2012</p>",#617d9f,1
partisan gerrymandering,majority representation,affects,NA,"Goedert 2014: The type of gerrymander (bipartisan, nonpartisan, partisan) can affect two aspects of representation: bias and responsiveness. Nagle 2019: Gerrymandering in Pennsylvania hinders responsiveness, so responsiveness ought to be its own redistricting criteria.",Goedert 2014; Nagle 2019,NA,2,8,"affects<br>Goedert 2014: The type of gerrymander (bipartisan, nonpartisan, partisan) can affect two aspects of representation: bias and responsiveness. Nagle 2019: Gerrymandering in Pennsylvania hinders responsiveness, so responsiveness ought to be its own redistricting criteria.<br>Goedert 2014; Nagle 2019",affects,"<p>affects<br>Goedert 2014: The type of gerrymander (bipartisan, nonpartisan, partisan) can affect two aspects of representation: bias and responsiveness. Nagle 2019: Gerrymandering in Pennsylvania hinders responsiveness, so responsiveness ought to be its own redistricting criteria.<br>Goedert 2014; Nagle 2019</p>",#617d9f,2
detect gerrymandering,inequality of opportunity vs outcome,NA,NA,Wang et al. 2018,Wang et al. 2018,NA,1,3,<br>Wang et al. 2018<br>Wang et al. 2018,NA,<p><br>Wang et al. 2018<br>Wang et al. 2018</p>,NA,1
change in constituency boundaries,electorate composition change,increases,NA,"Changing the boundaries of a district will necessarily cange who is in the district, but the reverse is not necessarily true. A electorate can change without the district boundaries changing.",Bertelli & Carson 2011; Hood & McKee 2013; Ansolabehere & Snyder 2012,NA,3,4,"increases<br>Changing the boundaries of a district will necessarily cange who is in the district, but the reverse is not necessarily true. A electorate can change without the district boundaries changing.<br>Bertelli & Carson 2011; Hood & McKee 2013; Ansolabehere & Snyder 2012",increases,"<p>increases<br>Changing the boundaries of a district will necessarily cange who is in the district, but the reverse is not necessarily true. A electorate can change without the district boundaries changing.<br>Bertelli & Carson 2011; Hood & McKee 2013; Ansolabehere & Snyder 2012</p>",#81a275,3
